titolo_annuncio,link_annuncio
"Appartamento via Paolo Pallia, Rogoredo, Milano",https://www.immobiliare.it/annunci/122102216/
"Quadrilocale via Cesare da Sesto 10, Corso Genova, Milano",https://www.immobiliare.it/annunci/122108616/
"Bilocale via Moretto da Brescia 21, Città Studi, Milano",https://www.immobiliare.it/annunci/122088616/
"Bilocale via adolfo Omodeo 25, Gallaratese, Milano",https://www.immobiliare.it/annunci/122101840/
"Bilocale via Arcangelo Corelli 25, Ortica, Milano",https://www.immobiliare.it/annunci/122103986/
"Trilocale via Gianfranco Malipiero 12, Viale Ungheria - Mecenate, Milano",https://www.immobiliare.it/annunci/122089754/
"Bilocale piazza Guglielmo Oberdan 2, Porta Venezia, Milano",https://www.immobiliare.it/annunci/122088710/
"Quadrilocale via Lorenteggio, 155, Giambellino, Milano",https://www.immobiliare.it/annunci/122088396/
"Quadrilocale via Pergolesi, Buenos Aires, Milano",https://www.immobiliare.it/annunci/122089616/
"Appartamento all'asta via Don Ernesto Vercesi, 13, Milano",https://www.immobiliare.it/annunci/122100040/
"Trilocale via Giovanni Ventura 2, Lambrate, Milano",https://www.immobiliare.it/annunci/122092520/
"Trilocale via Giovanni Battista Sammartini 49, Cascina dei Pomi, Milano",https://www.immobiliare.it/annunci/122094098/
"Trilocale via Cardinale Giovanni Cagliero 17, Maggiolina, Milano",https://www.immobiliare.it/annunci/122098012/
"Appartamento all'asta via Jacopino da Tradate 9, Milano",https://www.immobiliare.it/annunci/122096676/
"Trilocale via Antonio Pasinetti 12, Ripamonti, Milano",https://www.immobiliare.it/annunci/122087626/
"Trilocale piazza Enrico Chiaradia 12, Vigentino - Fatima, Milano",https://www.immobiliare.it/annunci/122103358/
"Bilocale via Appennini 113, Gallaratese, Milano",https://www.immobiliare.it/annunci/122089870/
"Appartamento all'asta via Francesco Burlamacchi 11, Milano",https://www.immobiliare.it/annunci/122103146/
"Attico via Giovanni Bellezza 7, Bocconi, Milano",https://www.immobiliare.it/annunci/122095346/
"Appartamento all'asta via Manfredonia 6, Milano",https://www.immobiliare.it/annunci/122097608/
"Quadrilocale corso di Porta Romana 16, Missori, Milano",https://www.immobiliare.it/annunci/122093068/
"Bilocale via Goffredo Mameli 9, Indipendenza, Milano",https://www.immobiliare.it/annunci/122089640/
"Appartamento all'asta via Jacopino Da Tradate 9, Milano",https://www.immobiliare.it/annunci/122088050/
"Trilocale via Antonio Bronzino 13, Città Studi, Milano",https://www.immobiliare.it/annunci/122090244/
"Quadrilocale via Paolo Uccello 5, Monte Rosa - Lotto, Milano",https://www.immobiliare.it/annunci/122090930/
"Appartamento all'asta via Francesco Burlamacchi 11, Milano",https://www.immobiliare.it/annunci/122095852/
"Trilocale via Cesare Cesariano 8, Arena, Milano",https://www.immobiliare.it/annunci/122101648/
"Bilocale via Mercato 18, Brera, Milano",https://www.immobiliare.it/annunci/122091262/
"Trilocale via Plezzo 78, Udine, Milano",https://www.immobiliare.it/annunci/122093906/
"Bilocale viale Ortles 90, Corvetto, Milano",https://www.immobiliare.it/annunci/122088866/
"Appartamento all'asta via Osteno 2, Milano",https://www.immobiliare.it/annunci/122083706/
"Appartamento all'asta via Felice Orsini 70, Milano",https://www.immobiliare.it/annunci/122083636/
"Appartamento all'asta via Carlo Perini 21, Milano",https://www.immobiliare.it/annunci/122091844/
"Bilocale via Pier Paolo Pasolini 4, Cascina Merlata - Musocco, Milano",https://www.immobiliare.it/annunci/122100878/
"Bilocale largo Promessi Sposi 9, Cantalupa - San Paolo, Milano",https://www.immobiliare.it/annunci/122087786/
"Bilocale viale Teodorico 19, Sempione, Milano",https://www.immobiliare.it/annunci/122099024/
"Trilocale corso di Porta Romana, Quadronno - Crocetta, Milano",https://www.immobiliare.it/annunci/122092378/
"Bilocale via Carlo Imbonati 10, Dergano, Milano",https://www.immobiliare.it/annunci/122103738/
"Bilocale via Giuseppe Ripamonti, Vigentino - Fatima, Milano",https://www.immobiliare.it/annunci/122083256/
"Bilocale via Clefi, Frua, Milano",https://www.immobiliare.it/annunci/122083268/
"Bilocale via Giovanni Battista Moroni, Gambara, Milano",https://www.immobiliare.it/annunci/122083260/
"Quadrilocale via Leoncavallo 39, Parco Trotter, Milano",https://www.immobiliare.it/annunci/122088582/
"Trilocale via Bari, Tre Castelli - Faenza, Milano",https://www.immobiliare.it/annunci/122083276/
"Trilocale via Washington, Washington, Milano",https://www.immobiliare.it/annunci/122083248/
"Bilocale via Raffaello Sanzio, De Angeli, Milano",https://www.immobiliare.it/annunci/122083274/
"Trilocale via Anacreonte 7, Cimiano, Milano",https://www.immobiliare.it/annunci/122088258/
"Appartamento all'asta via Francesco Burlamacchi 11, Milano",https://www.immobiliare.it/annunci/122098128/
"Trilocale via Francesco Cilea, Gallaratese, Milano",https://www.immobiliare.it/annunci/122083236/
"Appartamento via Muratori, 29, Porta Romana - Medaglie d'Oro, Milano",https://www.immobiliare.it/annunci/122088392/
"Trilocale via Ciceri Visconti 14, Martini - Insubria, Milano",https://www.immobiliare.it/annunci/122096082/
"Bilocale via Dell'Usignolo, Inganni, Milano",https://www.immobiliare.it/annunci/122083262/
"Bilocale viale Campania, Plebisciti - Susa, Milano",https://www.immobiliare.it/annunci/122094812/
"Loft via Francesco Brioschi 5, Corso San Gottardo, Milano",https://www.immobiliare.it/annunci/122083250/
"Bilocale via Innocenzo Isimbardi, Cermenate - Abbiategrasso, Milano",https://www.immobiliare.it/annunci/122083242/
"Trilocale via Carlo Imbonati, 25, 20158 Milano Italia, Dergano, Milano",https://www.immobiliare.it/annunci/122099598/
"Bilocale via branda castiglioni, Bovisa, Milano",https://www.immobiliare.it/annunci/122083266/
"Trilocale via Paolo Mezzanotte, Vigentino - Fatima, Milano",https://www.immobiliare.it/annunci/122083218/
"Appartamento via Antonio Mosca, Baggio, Milano",https://www.immobiliare.it/annunci/122083258/
"Bilocale via Giacomo Zanella 41, Argonne - Corsica, Milano",https://www.immobiliare.it/annunci/122101340/
"Bilocale via Giuseppe Meda 6, Ascanio Sforza, Milano",https://www.immobiliare.it/annunci/122105364/
"Monolocale via Macerata 1, Lodi - Brenta, Milano",https://www.immobiliare.it/annunci/122089554/
"Bilocale via Alessandro Tadino 46, Buenos Aires, Milano",https://www.immobiliare.it/annunci/122105398/
"Appartamento all'asta via Carlo Perini 21, Milano",https://www.immobiliare.it/annunci/122097018/
"Trilocale via Francesco Cavezzali, Cimiano, Milano",https://www.immobiliare.it/annunci/122092442/
"Appartamento all'asta via Manfredonia 6, Milano",https://www.immobiliare.it/annunci/122095810/
"Trilocale via Rizzardi 31, Trenno, Milano",https://www.immobiliare.it/annunci/122096338/
"Trilocale da ristrutturare, terzo piano, Bicocca, Milano",https://www.immobiliare.it/annunci/122088982/
"Bilocale viale Daniele Ranzoni 21, San Siro, Milano",https://www.immobiliare.it/annunci/122104276/
"Trilocale via Giovanni Pacini, Città Studi, Milano",https://www.immobiliare.it/annunci/122089812/
"Bilocale viale Monza 10, Pasteur, Milano",https://www.immobiliare.it/annunci/122101392/
"Trilocale via Rizzardi 31, Trenno, Milano",https://www.immobiliare.it/annunci/122096340/
"Loft via Dei Gracchi, Frua, Milano",https://www.immobiliare.it/annunci/122083280/
"Appartamento corso di Porta Romana 9, Missori, Milano",https://www.immobiliare.it/annunci/122093676/
"Bilocale via Luigi Prinetti 38, Cimiano, Milano",https://www.immobiliare.it/annunci/122090548/
"Bilocale via Ippodromo, Gallaratese, Milano",https://www.immobiliare.it/annunci/122083264/
"Appartamento via Giosuè Carducci 21, Sant'Ambrogio, Milano",https://www.immobiliare.it/annunci/122094414/
"Quadrilocale via Pier Paolo Pasolini, Cascina Merlata - Musocco, Milano",https://www.immobiliare.it/annunci/122101730/
"Trilocale via Rizzardi 31, Trenno, Milano",https://www.immobiliare.it/annunci/122098298/
"Trilocale via Benaco 5, Lodi - Brenta, Milano",https://www.immobiliare.it/annunci/122104790/
"Trilocale via grisi 4, Bruzzano, Milano",https://www.immobiliare.it/annunci/122090158/
"Appartamento all'asta via Jacopino Da Tradate, 9, Milano",https://www.immobiliare.it/annunci/122083770/
"Appartamento all'asta via Jacopino Da Tradate, 9, Milano",https://www.immobiliare.it/annunci/122083772/
"Bilocale via Santa Monica 3, Prato Centenaro, Milano",https://www.immobiliare.it/annunci/122088872/
"Bilocale Luigi Pasteur 17, Pasteur, Milano",https://www.immobiliare.it/annunci/122088036/
"Trilocale da ristrutturare, terzo piano, Rovereto, Milano",https://www.immobiliare.it/annunci/122088880/
"Bilocale via Andrea Massena 21, Arco della Pace, Milano",https://www.immobiliare.it/annunci/122092082/
"Trilocale via Pietro Pomponazzi 10, Pezzotti - Meda, Milano",https://www.immobiliare.it/annunci/122089444/
"Palazzo - stabile all'asta via Selvanesco, 50, Milano",https://www.immobiliare.it/annunci/122084522/
"Quadrilocale via Pasquale Sottocorno, Piave - Tricolore, Milano",https://www.immobiliare.it/annunci/122094446/
"Villa unifamiliare via Comelico, Cadore, Milano",https://www.immobiliare.it/annunci/122099526/
"Appartamento all'asta via Felicite' Robert Lamennais, 7, Milano",https://www.immobiliare.it/annunci/122099008/
"Appartamento all'asta via Michele Saponaro, 38, Milano",https://www.immobiliare.it/annunci/122087080/
"Appartamento all'asta via Appennini, 39, Milano",https://www.immobiliare.it/annunci/122087636/
"Appartamento all'asta via Cascina Corba, 98, Milano",https://www.immobiliare.it/annunci/122091302/
"Quadrilocale via Duccio da Boninsegna 25, Pagano, Milano",https://www.immobiliare.it/annunci/122089404/
"Appartamento all'asta via Riccardo Balsamo Crivelli, 18, Milano",https://www.immobiliare.it/annunci/122099544/
"Bilocale ottimo stato, quarto piano, Navigli - Darsena, Milano",https://www.immobiliare.it/annunci/122093748/
"Appartamento all'asta via Lucca, 8, Milano",https://www.immobiliare.it/annunci/122100866/
"Trilocale via Nicolò Barabino, Corvetto, Milano",https://www.immobiliare.it/annunci/122090322/
"Appartamento all'asta via Cascina Corba, 98, Milano",https://www.immobiliare.it/annunci/122091596/
"Bilocale via Giuseppe Meda 6, Ascanio Sforza, Milano",https://www.immobiliare.it/annunci/122105334/
"Appartamento all'asta via Francesco Burlamacchi, 11, Milano",https://www.immobiliare.it/annunci/122096636/
"Trilocale viale Monza 309, Villa San Giovanni, Milano",https://www.immobiliare.it/annunci/122091674/
"Appartamento all'asta via Michele Saponaro, 38, Milano",https://www.immobiliare.it/annunci/122087078/
"Appartamento all'asta via Appennini, 39, Milano",https://www.immobiliare.it/annunci/122087634/
"Appartamento all'asta via Riccardo Balsamo Crivelli, 18, Milano",https://www.immobiliare.it/annunci/122099540/
"Appartamento all'asta via Felicite' Robert Lamennais, 7, Milano",https://www.immobiliare.it/annunci/122099004/
"Appartamento all'asta via Cascina Corba, 98, Milano",https://www.immobiliare.it/annunci/122091594/
"Appartamento all'asta via Lucca, 8, Milano",https://www.immobiliare.it/annunci/122100864/
"Appartamento all'asta via Cascina Corba, 98, Milano",https://www.immobiliare.it/annunci/122091296/
"Quadrilocale via Castelfidardo, Moscova, Milano",https://www.immobiliare.it/annunci/122122658/
"Bilocale viale Zara 132, Maggiolina, Milano",https://www.immobiliare.it/annunci/122095962/
"Palazzo - stabile all'asta via Selvanesco, 50, Milano",https://www.immobiliare.it/annunci/122096638/
"Bilocale via Marcona 107, Plebisciti - Susa, Milano",https://www.immobiliare.it/annunci/122129024/
"Appartamento all'asta via Francesco Burlamacchi, 11, Milano",https://www.immobiliare.it/annunci/122087158/
"Quadrilocale viale Fulvio Testi 56, Ca' Granda, Milano",https://www.immobiliare.it/annunci/122105504/
"Bilocale via Giacomo Watt 7, Barona, Milano",https://www.immobiliare.it/annunci/122098210/
"Loft via Bernardino Verro 31, Ripamonti, Milano",https://www.immobiliare.it/annunci/122105944/
"Trilocale via Battista De Rolandi 11, Certosa, Milano",https://www.immobiliare.it/annunci/122099612/
"Bilocale via Villapizzone 26, Certosa, Milano",https://www.immobiliare.it/annunci/122085152/
"Trilocale piazza Luigi di Savoia 24, Centrale, Milano",https://www.immobiliare.it/annunci/122100564/
"Attico da ristrutturare, 166 m², Vercelli - Wagner, Milano",https://www.immobiliare.it/annunci/122099236/
"Trilocale via Michele Lessona, Vialba, Milano",https://www.immobiliare.it/annunci/122096788/
"Appartamento viale Fulvio Testi 56, Ca' Granda, Milano",https://www.immobiliare.it/annunci/122099036/
"Bilocale via 5 Maggio, 23/27, Quarto Oggiaro, Milano",https://www.immobiliare.it/annunci/122102832/
"Monolocale viale  Mar  Jonio 9, San Siro, Milano",https://www.immobiliare.it/annunci/122104554/
"Appartamento all'asta via Privata Angiolo Maffucci, Milano",https://www.immobiliare.it/annunci/122094674/
"Appartamento corso Sempione 63, Sempione, Milano",https://www.immobiliare.it/annunci/122105848/
"Bilocale ottimo stato, piano terra, Navigli - Darsena, Milano",https://www.immobiliare.it/annunci/122088916/
"Appartamento all'asta via Privata Angiolo Maffucci, Milano",https://www.immobiliare.it/annunci/122094672/
"Trilocale via BALDUCCIO DA PISA 10, Ripamonti, Milano",https://www.immobiliare.it/annunci/122096520/
"Bilocale via Trasimeno 48, Quartiere Adriano, Milano",https://www.immobiliare.it/annunci/122098464/
"Appartamento da ristrutturare, terzo piano, Palestro, Milano",https://www.immobiliare.it/annunci/122100230/
"Trilocale via Bartolomeo Eustachi 52, Buenos Aires, Milano",https://www.immobiliare.it/annunci/122105516/
"Bilocale via bellerio , 1, Affori, Milano",https://www.immobiliare.it/annunci/122084882/
"Bilocale via Marcantonio Colonna, Certosa, Milano",https://www.immobiliare.it/annunci/122101388/
"Appartamento via Terraggio, Sant'Ambrogio, Milano",https://www.immobiliare.it/annunci/122091794/
"Bilocale via Candiani 114, Bovisa, Milano",https://www.immobiliare.it/annunci/122081108/
"Trilocale via Don Carlo Gnocchi, San Siro, Milano",https://www.immobiliare.it/annunci/122105794/
"Trilocale via Edoardo Chinotto, San Carlo, Milano",https://www.immobiliare.it/annunci/122105796/
"Appartamento all'asta via Carlo Perini, Milano",https://www.immobiliare.it/annunci/122084668/
"Bilocale via Candiani 114, Bovisa, Milano",https://www.immobiliare.it/annunci/122081110/
"Trilocale da ristrutturare, Baggio, Milano",https://www.immobiliare.it/annunci/122093612/
"Appartamento all'asta via Carlo Perini, Milano",https://www.immobiliare.it/annunci/122084666/
"Palazzo - stabile all'asta via Ercole Oldofredi,, 20124 Milano Italia, Milano",https://www.immobiliare.it/annunci/122082398/
"Monolocale via Mario Morgantini, San Siro, Milano",https://www.immobiliare.it/annunci/122105800/
"Palazzo - stabile all'asta via Francesco Burlamacchi,, 20135 Milano Italia, Milano",https://www.immobiliare.it/annunci/122082406/
"Appartamento all'asta via Manfredonia 6, Milano",https://www.immobiliare.it/annunci/122091190/
"Palazzo - stabile all'asta via Carlo Perini,, 20157 Milano Italia, Milano",https://www.immobiliare.it/annunci/122082410/
"Palazzo - stabile all'asta via Jacopino da Tradate,, 20155 Milano Italia, Milano",https://www.immobiliare.it/annunci/122082412/
"Palazzo - stabile all'asta via Selvanesco, Milano",https://www.immobiliare.it/annunci/122082408/
"Trilocale via Val Lagarina, Roserio, Milano",https://www.immobiliare.it/annunci/122094302/
"Monolocale Val Trompia, Roserio, Milano",https://www.immobiliare.it/annunci/122094308/
"Monolocale via Val Trompia, Roserio, Milano",https://www.immobiliare.it/annunci/122094306/
"Appartamento all'asta via Manfredonia, 6, Milano",https://www.immobiliare.it/annunci/122092762/
"Appartamento all'asta viale San Gimignano, 2, Milano",https://www.immobiliare.it/annunci/122092182/
"Appartamento all'asta viale San Gimignano, 2, Milano",https://www.immobiliare.it/annunci/122099474/
"Appartamento all'asta via Stresa, 1, Milano",https://www.immobiliare.it/annunci/122092154/
"Appartamento via Torino, Carrobbio, Milano",https://www.immobiliare.it/annunci/122095974/
"Appartamento all'asta via Francesco Burlamacchi, , 11, Milano",https://www.immobiliare.it/annunci/122101404/
"Rustico - casale all'asta via Selvanesco 50, Milano",https://www.immobiliare.it/annunci/122098372/
"Appartamento via dei Giardini, Brera, Milano",https://www.immobiliare.it/annunci/122087560/
"Appartamento piazza Lega Lombarda, Arena, Milano",https://www.immobiliare.it/annunci/122098674/
"Appartamento all'asta via Privata Angiolo Maffucci, 20158 Milano Italia, Milano",https://www.immobiliare.it/annunci/122092276/
"Appartamento all'asta via Manfredonia 6, Milano",https://www.immobiliare.it/annunci/122098522/
"Appartamento via dei Giardini, Brera, Milano",https://www.immobiliare.it/annunci/122096436/
"Appartamento all'asta via Jacopino da Tradate 9, Milano",https://www.immobiliare.it/annunci/122089212/
"Quadrilocale via dei Giardini, Brera, Milano",https://www.immobiliare.it/annunci/122087240/
"Trilocale via dell'Annunciata, Brera, Milano",https://www.immobiliare.it/annunci/122103364/
"Appartamento piazza Eleonora Duse, Palestro, Milano",https://www.immobiliare.it/annunci/122089026/
"Appartamento corso di Porta Nuova, Turati, Milano",https://www.immobiliare.it/annunci/122085928/
"Attico via dei Giardini, Brera, Milano",https://www.immobiliare.it/annunci/122098908/
"Appartamento via Daniele Manin, Turati, Milano",https://www.immobiliare.it/annunci/122090470/
"Attico via Montenapoleone, Scala - Manzoni, Milano",https://www.immobiliare.it/annunci/122098154/
"Appartamento via Lorenzo Mascheroni, Pagano, Milano",https://www.immobiliare.it/annunci/122099034/
"Attico via Brera, Brera, Milano",https://www.immobiliare.it/annunci/122096678/
"Bilocale piazza Sant'Ambrogio, Sant'Ambrogio, Milano",https://www.immobiliare.it/annunci/122100558/
"Attico corso Magenta, Cadorna - Castello, Milano",https://www.immobiliare.it/annunci/122091432/
"Trilocale via Bari, Barona, Milano",https://www.immobiliare.it/annunci/122101412/
"Quadrilocale via Lecco 18, Buenos Aires, Milano",https://www.immobiliare.it/annunci/122061496/
Appartamenti di nuova costruzione a Milano,https://www.immobiliare.it/annunci/122053138/
"Trilocale via Franco Tosi 8, Barona, Milano",https://www.immobiliare.it/annunci/122073678/
"Bilocale viale Premuda 40, Piave - Tricolore, Milano",https://www.immobiliare.it/annunci/122063646/
"Bilocale via Giancarlo Sismondi 62, Argonne - Corsica, Milano",https://www.immobiliare.it/annunci/122126700/
"Monolocale via Antonio Bronzino 13, Città Studi, Milano",https://www.immobiliare.it/annunci/122126748/
"Appartamento via Losanna 1, Sempione, Milano",https://www.immobiliare.it/annunci/122058604/
"Trilocale via Rimini 25, Famagosta, Milano",https://www.immobiliare.it/annunci/122070124/
"Trilocale via Antonio Tolomeo Trivulzio, 3, De Angeli, Milano",https://www.immobiliare.it/annunci/122053590/
"Loft via Balilla 28, Corso San Gottardo, Milano",https://www.immobiliare.it/annunci/122078010/
"Monolocale via Noto 17, Vigentino - Fatima, Milano",https://www.immobiliare.it/annunci/122073834/
"Bilocale via Luigi Zoja 31, Quarto Cagnino, Milano",https://www.immobiliare.it/annunci/122052766/
"Bilocale via Panfilo Castaldi 37, Porta Venezia, Milano",https://www.immobiliare.it/annunci/122060146/
"Trilocale viale Stelvio 53, Farini, Milano",https://www.immobiliare.it/annunci/122073450/
"Appartamento viale Coni Zugna, Solari, Milano",https://www.immobiliare.it/annunci/122053288/
"Appartamento via Filippo Turati, Turati, Milano",https://www.immobiliare.it/annunci/122052736/
"Bilocale via Vivaio 12, Palestro, Milano",https://www.immobiliare.it/annunci/122129482/
"Quadrilocale via Gaetano Strambio 20, Città Studi, Milano",https://www.immobiliare.it/annunci/122076760/
"Trilocale via Grado 5A, Turro, Milano",https://www.immobiliare.it/annunci/122073216/
"Trilocale via Vespri Siciliani 16, Piazza Napoli, Milano",https://www.immobiliare.it/annunci/122054746/
"Appartamento viale Gran Sasso, Città Studi, Milano",https://www.immobiliare.it/annunci/122076122/
"Bilocale via Enrico Nöe 2, Città Studi, Milano",https://www.immobiliare.it/annunci/122056222/
"Appartamento via Antonio Grumello 3, Dezza, Milano",https://www.immobiliare.it/annunci/122066360/
"Villa unifamiliare via Giuseppe Compagnoni 53, Plebisciti - Susa, Milano",https://www.immobiliare.it/annunci/122094810/
"Appartamento piazza Riccardo Wagner, Vercelli - Wagner, Milano",https://www.immobiliare.it/annunci/122054048/
"Bilocale via Giovanni Ameglio 13, Quarto Oggiaro, Milano",https://www.immobiliare.it/annunci/122064634/
"Bilocale via Mauro Macchi 50, Centrale, Milano",https://www.immobiliare.it/annunci/122070360/
"Bilocale via Angelo Poliziano 10, Sempione, Milano",https://www.immobiliare.it/annunci/122069824/
"Bilocale via Angelo Poliziano 10, Sempione, Milano",https://www.immobiliare.it/annunci/122070788/
"Appartamento via Bruno Maderna 17, Viale Ungheria - Mecenate, Milano",https://www.immobiliare.it/annunci/122062168/
"Attico via Costanza 19, Washington, Milano",https://www.immobiliare.it/annunci/122079660/
"Trilocale via Padova 55, Parco Trotter, Milano",https://www.immobiliare.it/annunci/122051988/
"Bilocale via Appennini 53, Gallaratese, Milano",https://www.immobiliare.it/annunci/122083652/
"Trilocale via Generale Giuseppe Govone 94, Ghisolfa - Mac Mahon, Milano",https://www.immobiliare.it/annunci/122066120/
"Bilocale via Giuseppe Meda 53, Pezzotti - Meda, Milano",https://www.immobiliare.it/annunci/122070592/
"Bilocale via Giuseppe Ripamonti 3A, Porta Romana - Medaglie d'Oro, Milano",https://www.immobiliare.it/annunci/122053506/
"Appartamento via Gaudenzio Ferrari, 3, Corso Genova, Milano",https://www.immobiliare.it/annunci/122062296/
"Trilocale via Bergamo, Montenero, Milano",https://www.immobiliare.it/annunci/122054350/
"Bilocale via Melzo 16, Porta Venezia, Milano",https://www.immobiliare.it/annunci/122059026/
"Bilocale via Alserio 28, Zara, Milano",https://www.immobiliare.it/annunci/122059458/
"Bilocale via Savona 140, Giambellino, Milano",https://www.immobiliare.it/annunci/122059204/
"Bilocale via Achille Fontanelli 13, Bruzzano, Milano",https://www.immobiliare.it/annunci/122062808/
"Bilocale via martinazzoli 2, Bruzzano, Milano",https://www.immobiliare.it/annunci/122054696/
"Appartamento ottimo stato, terzo piano, Quadronno - Crocetta, Milano",https://www.immobiliare.it/annunci/122065184/
"Bilocale Porta Ticinese, 16, Carrobbio, Milano",https://www.immobiliare.it/annunci/122058918/
"Bilocale via Perugino 32, Cadore, Milano",https://www.immobiliare.it/annunci/122063146/
"Bilocale via Palmanova 67, Cimiano, Milano",https://www.immobiliare.it/annunci/122060824/
"Villa unifamiliare, ottimo stato, 159 m², Famagosta, Milano",https://www.immobiliare.it/annunci/122114260/
"Bilocale via Carlo Boncompagni 3, Bologna - Sulmona, Milano",https://www.immobiliare.it/annunci/122054800/
"Monolocale via Monviso, Paolo Sarpi, Milano",https://www.immobiliare.it/annunci/122059694/
"Trilocale via Cefalu' 24, Gallaratese, Milano",https://www.immobiliare.it/annunci/122068378/
"Bilocale via Cadore, Cadore, Milano",https://www.immobiliare.it/annunci/122063414/
"Monolocale via FEDERICO CONFALONIERI 5, Isola, Milano",https://www.immobiliare.it/annunci/122077790/
"Trilocale viale Corsica 37, Argonne - Corsica, Milano",https://www.immobiliare.it/annunci/122053694/
"Trilocale via Vivarini 5, Pezzotti - Meda, Milano",https://www.immobiliare.it/annunci/122062180/
"Trilocale via Guido Cavalcanti 8, Pasteur, Milano",https://www.immobiliare.it/annunci/122075306/
"Palazzo - Edificio via Chioggia 6, Turro, Milano",https://www.immobiliare.it/annunci/122076510/
"Bilocale via Carlo Boncompagni 3, Bologna - Sulmona, Milano",https://www.immobiliare.it/annunci/122054638/
"Bilocale via Don Bartolomeo Grazioli, Dergano, Milano",https://www.immobiliare.it/annunci/122071664/
"Trilocale via Leopoldo Marchetti 1, Pezzotti - Meda, Milano",https://www.immobiliare.it/annunci/122057914/
"Bilocale corso Buenos Aires 37, Buenos Aires, Milano",https://www.immobiliare.it/annunci/122055548/
"Bilocale via Lodovico il Moro 61, Tre Castelli - Faenza, Milano",https://www.immobiliare.it/annunci/122049896/
"Bilocale ottimo stato, terzo piano, Cascina Merlata - Musocco, Milano",https://www.immobiliare.it/annunci/122078402/
"Quadrilocale via Fontana, Guastalla, Milano",https://www.immobiliare.it/annunci/122090544/
"Bilocale piazza Ernesto De Angeli, De Angeli, Milano",https://www.immobiliare.it/annunci/122058142/
"Bilocale via Marco Tullio Tirone 5, Ortica, Milano",https://www.immobiliare.it/annunci/122080094/
"Trilocale via ajaccio 13, Città Studi, Milano",https://www.immobiliare.it/annunci/122076618/
"Trilocale via Romualdo Bonfadini, Viale Ungheria - Mecenate, Milano",https://www.immobiliare.it/annunci/122077882/
"Bilocale via Giancarlo Sismondi 62, Argonne - Corsica, Milano",https://www.immobiliare.it/annunci/122126722/
"Quadrilocale viale Liguria 40, Famagosta, Milano",https://www.immobiliare.it/annunci/122072932/
"Trilocale viale Beatrice d'Este 30, Bocconi, Milano",https://www.immobiliare.it/annunci/122058314/
"Monolocale via Antonio Bronzino 13, Città Studi, Milano",https://www.immobiliare.it/annunci/122126760/
"Bilocale Alzaia Naviglio Pavese 288, Cantalupa - San Paolo, Milano",https://www.immobiliare.it/annunci/122070188/
"Bilocale via Privata Chiasso 11, Ghisolfa - Mac Mahon, Milano",https://www.immobiliare.it/annunci/122060238/
"Quadrilocale via Paterno' 3, Tre Castelli - Faenza, Milano",https://www.immobiliare.it/annunci/122077218/
"Bilocale via degli Imbriani 1, Bovisa, Milano",https://www.immobiliare.it/annunci/122057602/
"Bilocale via Massimo Gorki 11, Giambellino, Milano",https://www.immobiliare.it/annunci/122060118/
"Bilocale piazza Enrico Berlinguer, Piazza Napoli, Milano",https://www.immobiliare.it/annunci/122060494/
