titolo_annuncio,link_annuncio
"Attico via Bolzano 29/a, Rovereto, Milano",https://www.immobiliare.it/annunci/122063794/
"Bilocale via Guinizelli 3, Pasteur, Milano",https://www.immobiliare.it/annunci/122075082/
"Trilocale via Savona 108, Giambellino, Milano",https://www.immobiliare.it/annunci/122060800/
"Trilocale via appennini 61, Gallaratese, Milano",https://www.immobiliare.it/annunci/122078938/
"Appartamento via Padova 236, Crescenzago, Milano",https://www.immobiliare.it/annunci/122074482/
"Trilocale via Massimo Gorki 1, Giambellino, Milano",https://www.immobiliare.it/annunci/122054660/
"Monolocale via Tito Vignoli 11, Giambellino, Milano",https://www.immobiliare.it/annunci/122053716/
"Monolocale via Giacinto Bruzzesi 37, Giambellino, Milano",https://www.immobiliare.it/annunci/122057086/
"Bilocale via Vincenzo Magliocco 5, Pezzotti - Meda, Milano",https://www.immobiliare.it/annunci/122060774/
"Trilocale via Antonio Mambretti 5, Quarto Oggiaro, Milano",https://www.immobiliare.it/annunci/122066154/
"Bilocale via Ottavio Rinuccini 3, Rovereto, Milano",https://www.immobiliare.it/annunci/122070640/
"Trilocale via Cesare da Sesto 10, Corso Genova, Milano",https://www.immobiliare.it/annunci/122077964/
"Bilocale via Carlo Perini 18, Quarto Oggiaro, Milano",https://www.immobiliare.it/annunci/122076322/
"Monolocale via Cesare da Sesto 10, Corso Genova, Milano",https://www.immobiliare.it/annunci/122077308/
"Bilocale via Cesare da Sesto 10, Corso Genova, Milano",https://www.immobiliare.it/annunci/122077696/
"Bilocale via Pietro Crespi, 10, Pasteur, Milano",https://www.immobiliare.it/annunci/122050148/
"Quadrilocale piazza Firenze, Sempione, Milano",https://www.immobiliare.it/annunci/122060998/
"Appartamento all'asta via Ercole Oldofredi 47, Milano",https://www.immobiliare.it/annunci/122077332/
"Monolocale via Ettore Ponti 57, Barona, Milano",https://www.immobiliare.it/annunci/122053008/
"Bilocale via Mauro Macchi 50, Centrale, Milano",https://www.immobiliare.it/annunci/122070358/
"Trilocale via Vivaio, Palestro, Milano",https://www.immobiliare.it/annunci/122055156/
"Bilocale via Eschilo 8, City Life, Milano",https://www.immobiliare.it/annunci/122055994/
"Bilocale via Gargano 17, Corvetto, Milano",https://www.immobiliare.it/annunci/122059900/
"Trilocale piazza Firenze, Sempione, Milano",https://www.immobiliare.it/annunci/122063154/
"Trilocale via Gioacchino Rossini, Palestro, Milano",https://www.immobiliare.it/annunci/122053812/
"Appartamento all'asta via Palmanova, 8, Milano",https://www.immobiliare.it/annunci/122054996/
"Trilocale via Costanza 19, Washington, Milano",https://www.immobiliare.it/annunci/122058276/
"Bilocale via Giuseppe Antonio Borgese 14, Cenisio, Milano",https://www.immobiliare.it/annunci/122064182/
"Appartamento all'asta via Riccardo Balsamo Crivelli 18, Milano",https://www.immobiliare.it/annunci/122060500/
"Bilocale via Evangelista Torricelli 5, Ascanio Sforza, Milano",https://www.immobiliare.it/annunci/122077148/
"Appartamento all'asta via Lucca 8, Milano",https://www.immobiliare.it/annunci/122062702/
"Appartamento all'asta via Lucca 8, Milano",https://www.immobiliare.it/annunci/122062352/
"Trilocale via Antonio Aldini 28, Vialba, Milano",https://www.immobiliare.it/annunci/122059032/
"Trilocale via Franco Faccio 20, Affori, Milano",https://www.immobiliare.it/annunci/122063886/
"Bilocale via Montecassino 24, Ponte Lambro, Milano",https://www.immobiliare.it/annunci/122064584/
"Villa unifamiliare via Bari, Tre Castelli - Faenza, Milano",https://www.immobiliare.it/annunci/122113920/
"Trilocale via Franco Faccio 20, Affori, Milano",https://www.immobiliare.it/annunci/122063582/
"Attico via Michelangelo Buonarroti 4, Vercelli - Wagner, Milano",https://www.immobiliare.it/annunci/122074884/
"Bilocale piazza Prealpi 3, Certosa, Milano",https://www.immobiliare.it/annunci/122060872/
"Trilocale via Ovada 7, Famagosta, Milano",https://www.immobiliare.it/annunci/122064538/
"Bilocale via Esculapio 4, Comasina, Milano",https://www.immobiliare.it/annunci/122065886/
"Villa a schiera via del Mare, Cantalupa - San Paolo, Milano",https://www.immobiliare.it/annunci/122058488/
"Trilocale via Ponte Seveso 33, Centrale, Milano",https://www.immobiliare.it/annunci/122065722/
"Monolocale via Magolfa, Navigli - Darsena, Milano",https://www.immobiliare.it/annunci/122058498/
"Trilocale via Bartolomeo Colleoni 9, Sempione, Milano",https://www.immobiliare.it/annunci/122080022/
"Bilocale via Ennio Morlotti 11, Bruzzano, Milano",https://www.immobiliare.it/annunci/122053080/
"Bilocale via Padova, 191, Cimiano, Milano",https://www.immobiliare.it/annunci/122054608/
"Bilocale via Errico Petrella 21, Buenos Aires, Milano",https://www.immobiliare.it/annunci/122060964/
"Trilocale via Padova 336, Crescenzago, Milano",https://www.immobiliare.it/annunci/122056820/
"Trilocale via Antonio Cechov 20, Gallaratese, Milano",https://www.immobiliare.it/annunci/122076576/
"Appartamento all'asta via Felicité Robert De Lamennais 7, Milano",https://www.immobiliare.it/annunci/122051040/
"Bilocale buono stato, primo piano, Piazza Napoli, Milano",https://www.immobiliare.it/annunci/122059808/
"Appartamento via Monte Rosa 21, Amendola - Buonarroti, Milano",https://www.immobiliare.it/annunci/122077412/
"Quadrilocale via Ettore Ciccotti 8, Affori, Milano",https://www.immobiliare.it/annunci/122047394/
"Monolocale via della Chiesa Rossa, Cermenate - Abbiategrasso, Milano",https://www.immobiliare.it/annunci/122063838/
"Appartamento via Vitruvio 43, Centrale, Milano",https://www.immobiliare.it/annunci/122055784/
"Attico via Antonio Meucci 85, Ponte Nuovo, Milano",https://www.immobiliare.it/annunci/122077640/
"Monolocale viale Abruzzi 19, Morgagni, Milano",https://www.immobiliare.it/annunci/122071032/
"Trilocale viale Omero, Corvetto, Milano",https://www.immobiliare.it/annunci/122053682/
"Trilocale via Bernardino Bellincione 10, Quartiere Feltre, Milano",https://www.immobiliare.it/annunci/122070156/
"Appartamento ottimo stato, primo piano, Buenos Aires, Milano",https://www.immobiliare.it/annunci/122076434/
"Bilocale ottimo stato, primo piano, Piazza Napoli, Milano",https://www.immobiliare.it/annunci/122053298/
"Bilocale via Giuseppe Gianella 26, Baggio, Milano",https://www.immobiliare.it/annunci/122063894/
"Bilocale via Michele Lessona 2, Vialba, Milano",https://www.immobiliare.it/annunci/122066186/
"Trilocale via Gadames 121, Cascina Merlata - Musocco, Milano",https://www.immobiliare.it/annunci/122072470/
"Trilocale piazza Simone Bolivar 7, Piazza Napoli, Milano",https://www.immobiliare.it/annunci/122069696/
"Trilocale viale bligny 50, Bocconi, Milano",https://www.immobiliare.it/annunci/122057152/
"Bilocale viale Monte Grappa 16, Garibaldi - Corso Como, Milano",https://www.immobiliare.it/annunci/122054512/
"Monolocale ottimo stato, piano rialzato, Piazza Napoli, Milano",https://www.immobiliare.it/annunci/122054534/
"Bilocale viale bligny 50, Bocconi, Milano",https://www.immobiliare.it/annunci/122057146/
"Monolocale buono stato, primo piano, Piazza Napoli, Milano",https://www.immobiliare.it/annunci/122057326/
"Trilocale via Gerolamo Forni 4, Comasina, Milano",https://www.immobiliare.it/annunci/122126408/
"Loft via Rodolfo Farneti, Buenos Aires, Milano",https://www.immobiliare.it/annunci/122063400/
"Bilocale via del Mare, Cantalupa - San Paolo, Milano",https://www.immobiliare.it/annunci/122064162/
"Trilocale via Mar nero 5, Bisceglie, Milano",https://www.immobiliare.it/annunci/122063936/
"Trilocale ottimo stato, primo piano, Porta Venezia, Milano",https://www.immobiliare.it/annunci/122057256/
"Quadrilocale via Varese 10, Moscova, Milano",https://www.immobiliare.it/annunci/122073836/
"Monolocale via degli Umiliati 26, Ponte Lambro, Milano",https://www.immobiliare.it/annunci/122059904/
"Trilocale viale San Gimignano, Bande Nere, Milano",https://www.immobiliare.it/annunci/122059232/
"Bilocale ottimo stato, piano rialzato, Porta Venezia, Milano",https://www.immobiliare.it/annunci/122058290/
"Appartamento all'asta via Ercole Oldofredi,, 47, Milano",https://www.immobiliare.it/annunci/122065312/
"Attico da ristrutturare, 300 m², Sempione, Milano",https://www.immobiliare.it/annunci/122077962/
"Bilocale ottimo stato, secondo piano, Palestro, Milano",https://www.immobiliare.it/annunci/122061034/
"Quadrilocale via Catania 6, Argonne - Corsica, Milano",https://www.immobiliare.it/annunci/122074758/
"Quadrilocale viale Monte Ceneri 58, Ghisolfa - Mac Mahon, Milano",https://www.immobiliare.it/annunci/122066968/
"Trilocale via Petrella , 14, Buenos Aires, Milano",https://www.immobiliare.it/annunci/122057448/
"Appartamento all'asta via Ercole Oldofredi,, 47, Milano",https://www.immobiliare.it/annunci/122065310/
"Trilocale via Boscovich 3, Centrale, Milano",https://www.immobiliare.it/annunci/122057970/
"Bilocale viale Monte Nero, Montenero, Milano",https://www.immobiliare.it/annunci/122047590/
"Bilocale via Sandro Botticelli 34, Città Studi, Milano",https://www.immobiliare.it/annunci/122053850/
"Trilocale viale Giovanni Suzzani 142, Bicocca, Milano",https://www.immobiliare.it/annunci/122073016/
"Bilocale ottimo stato, quarto piano, Tre Castelli - Faenza, Milano",https://www.immobiliare.it/annunci/122093644/
"Appartamento all'asta via Lorenteggio, 205, Milano",https://www.immobiliare.it/annunci/122054748/
"Bilocale via Benevento, 3, Tre Castelli - Faenza, Milano",https://www.immobiliare.it/annunci/122050390/
"Appartamento all'asta via Dei Salici, 10, Milano",https://www.immobiliare.it/annunci/122057202/
"Appartamento all'asta via Gaspare Aselli, 18, Milano",https://www.immobiliare.it/annunci/122053726/
"Trilocale via Benevento, 3, Tre Castelli - Faenza, Milano",https://www.immobiliare.it/annunci/122050378/
"Trilocale via Lodovico Montegani 14, Cermenate - Abbiategrasso, Milano",https://www.immobiliare.it/annunci/122091664/
"Appartamento all'asta via Ercole Oldofredi, 47, Milano",https://www.immobiliare.it/annunci/122062458/
"Bilocale via Cristoforo Gluck 45, Cascina dei Pomi, Milano",https://www.immobiliare.it/annunci/122049898/
"Appartamento all'asta via Dei Salici, 10, Milano",https://www.immobiliare.it/annunci/122057200/
"Quadrilocale piazza Tirana, Giambellino, Milano",https://www.immobiliare.it/annunci/122096888/
"Appartamento all'asta via Gaspare Aselli, 18, Milano",https://www.immobiliare.it/annunci/122053724/
"Quadrilocale piazza Tirana, Giambellino, Milano",https://www.immobiliare.it/annunci/122096866/
"Bilocale da ristrutturare, primo piano, Piazza Napoli, Milano",https://www.immobiliare.it/annunci/122052824/
"Bilocale ottimo stato, su più livelli, Frua, Milano",https://www.immobiliare.it/annunci/122063930/
"Bilocale via Melchiorre Gioia 82, Centrale, Milano",https://www.immobiliare.it/annunci/122047558/
"Bilocale via Crimea 21, Bande Nere, Milano",https://www.immobiliare.it/annunci/122063192/
"Monolocale via Benevento, 3, Tre Castelli - Faenza, Milano",https://www.immobiliare.it/annunci/122050388/
"Appartamento viale San Gimignano 2, Lorenteggio, Milano",https://www.immobiliare.it/annunci/122047460/
"Bilocale via Carlo Farini, Isola, Milano",https://www.immobiliare.it/annunci/122067032/
"Trilocale via Voltri, Cantalupa - San Paolo, Milano",https://www.immobiliare.it/annunci/122060164/
"Trilocale via degli Umiliati, Ponte Lambro, Milano",https://www.immobiliare.it/annunci/122077668/
"Villa bifamiliare, ottimo stato, 300 m², Solari, Milano",https://www.immobiliare.it/annunci/122121142/
"Appartamento all'asta via Ercole Oldofredi, 47, Milano",https://www.immobiliare.it/annunci/122054374/
"Monolocale via Alfonso Capecelatro 29, San Siro, Milano",https://www.immobiliare.it/annunci/122060722/
"Appartamento all'asta via Cesare Ajraghi, Milano",https://www.immobiliare.it/annunci/122055436/
"Loft via Melchiorre Gioia 82, Centrale, Milano",https://www.immobiliare.it/annunci/122049892/
"Appartamento all'asta via Cesare Ajraghi, Milano",https://www.immobiliare.it/annunci/122055432/
"Monolocale via Vitruvio 43, Centrale, Milano",https://www.immobiliare.it/annunci/122076658/
"Trilocale ottimo stato, secondo piano, Farini, Milano",https://www.immobiliare.it/annunci/122073494/
"Appartamento all'asta via Lorenteggio, 205, Milano",https://www.immobiliare.it/annunci/122054742/
"Appartamento all'asta via Ercole Oldofredi, 47, Milano",https://www.immobiliare.it/annunci/122053640/
"Monolocale via Lodovico il Moro 159, Tre Castelli - Faenza, Milano",https://www.immobiliare.it/annunci/122072164/
"Bilocale via Giuseppe Giacosa 11, Parco Trotter, Milano",https://www.immobiliare.it/annunci/122065314/
"Trilocale via Fonzaso, San Siro, Milano",https://www.immobiliare.it/annunci/122060928/
"Bilocale via Adele Martignoni 1, Maggiolina, Milano",https://www.immobiliare.it/annunci/122076406/
"Monolocale via M. Saponaro, Gratosoglio, Milano",https://www.immobiliare.it/annunci/122056310/
"Loft, ottimo stato, piano terra, Rovereto, Milano",https://www.immobiliare.it/annunci/122062144/
"Appartamento all'asta via Francesco Burlamacchi 11, Milano",https://www.immobiliare.it/annunci/122078742/
"Trilocale via Privata Sanremo 14, Argonne - Corsica, Milano",https://www.immobiliare.it/annunci/122075714/
"Quadrilocale via Rembrandt, Piazzale Siena, Milano",https://www.immobiliare.it/annunci/122073770/
"Appartamento all'asta via Michele Saponaro 38, Milano",https://www.immobiliare.it/annunci/122054526/
"Appartamento all'asta via Cascina Corba 98, Milano",https://www.immobiliare.it/annunci/122056826/
"Attico nuovo, 238 m², Navigli - Darsena, Milano",https://www.immobiliare.it/annunci/122047426/
"Appartamento all'asta via Francesco Burlamacchi   11, Milano",https://www.immobiliare.it/annunci/122072816/
"Appartamento via Palmanova, 8, Udine, Milano",https://www.immobiliare.it/annunci/122076582/
"Trilocale via Varesina, 62, Certosa, Milano",https://www.immobiliare.it/annunci/122076478/
"Quadrilocale viale Piave, Piave - Tricolore, Milano",https://www.immobiliare.it/annunci/122079174/
"Appartamento all'asta via Jacopino da Tradate 9, Milano",https://www.immobiliare.it/annunci/122079024/
"Quadrilocale torino, Carrobbio, Milano",https://www.immobiliare.it/annunci/122073112/
"Appartamento all'asta via Palmanova, 8, Milano",https://www.immobiliare.it/annunci/122058642/
"Trilocale via Sulmona, Bologna - Sulmona, Milano",https://www.immobiliare.it/annunci/122054708/
"Trilocale via Privata Sanremo, 14, Argonne - Corsica, Milano",https://www.immobiliare.it/annunci/122063180/
"Appartamento all'asta via Carlo Perini 21, Milano",https://www.immobiliare.it/annunci/122079620/
"Appartamento via dei Giardini, Brera, Milano",https://www.immobiliare.it/annunci/122076974/
"Appartamento all'asta via Lucca 8, Milano",https://www.immobiliare.it/annunci/122064482/
"Appartamento all'asta via Felicité Robert De Lamennais 7, Milano",https://www.immobiliare.it/annunci/122068112/
"Loft piazzale Aquileia, Dezza, Milano",https://www.immobiliare.it/annunci/122076542/
"Appartamento all'asta via Michele Saponaro 38, Milano",https://www.immobiliare.it/annunci/122059878/
"Palazzo - Edificio, San Vittore, Milano",https://www.immobiliare.it/annunci/122080090/
"Appartamento via San Barnaba, Guastalla, Milano",https://www.immobiliare.it/annunci/122077120/
"Attico piazza Piemonte, Washington, Milano",https://www.immobiliare.it/annunci/122074938/
"Appartamento via Brera, Brera, Milano",https://www.immobiliare.it/annunci/122072088/
"Palazzo - Edificio buono stato, Corvetto, Milano",https://www.immobiliare.it/annunci/122063070/
"Bilocale via Luigi Resnati 1, Martini - Insubria, Milano",https://www.immobiliare.it/annunci/122078694/
"Bilocale via Giampietro Lucini 19, Maggiolina, Milano",https://www.immobiliare.it/annunci/122076792/
"Monolocale via Console Marcello 12, Bovisa, Milano",https://www.immobiliare.it/annunci/122062932/
"Bilocale via Giuseppe Ripamonti, Ripamonti, Milano",https://www.immobiliare.it/annunci/122058570/
"Bilocale via Girardo Patecchio 2, Vigentino - Fatima, Milano",https://www.immobiliare.it/annunci/122045336/
"Bilocale via Luca Ghini 4, Ripamonti, Milano",https://www.immobiliare.it/annunci/122042226/
"Appartamento largo Riccardo Zandonai, Pagano, Milano",https://www.immobiliare.it/annunci/122029326/
"Bilocale via Girardo Patecchio 2, Vigentino - Fatima, Milano",https://www.immobiliare.it/annunci/122044778/
"Trilocale via Bernardino Verro, Vigentino - Fatima, Milano",https://www.immobiliare.it/annunci/122028946/
"Bilocale viale Giovanni da Cermenate 39, Pezzotti - Meda, Milano",https://www.immobiliare.it/annunci/122043070/
"Trilocale via Feltre 66, Quartiere Feltre, Milano",https://www.immobiliare.it/annunci/122031182/
"Bilocale via Messina 5, Paolo Sarpi, Milano",https://www.immobiliare.it/annunci/122025716/
"Trilocale via Mario Donati 6, Tripoli - Soderini, Milano",https://www.immobiliare.it/annunci/122031978/
"Trilocale via Generale Giuseppe Govone 83, Ghisolfa - Mac Mahon, Milano",https://www.immobiliare.it/annunci/122033154/
"Quadrilocale piazza del Tricolore, Piave - Tricolore, Milano",https://www.immobiliare.it/annunci/122041880/
"Appartamento corso San Gottardo, Corso San Gottardo, Milano",https://www.immobiliare.it/annunci/122035530/
"Appartamento via Edmondo De Amicis, Corso Genova, Milano",https://www.immobiliare.it/annunci/122042516/
"Quadrilocale viale Coni Zugna, Solari, Milano",https://www.immobiliare.it/annunci/122036096/
"Appartamento via Giuseppe Piolti de' Bianchi, Plebisciti - Susa, Milano",https://www.immobiliare.it/annunci/122039298/
"Bilocale via Lecco 6, Porta Venezia, Milano",https://www.immobiliare.it/annunci/122045928/
"Bilocale via Generale Giuseppe Govone 83, Ghisolfa - Mac Mahon, Milano",https://www.immobiliare.it/annunci/122033884/
"Trilocale piazza Aspromonte 13, Città Studi, Milano",https://www.immobiliare.it/annunci/122041478/
"Appartamento via Felice Casati 12, Buenos Aires, Milano",https://www.immobiliare.it/annunci/122040906/
"Bilocale via Treviglio 30, Ponte Nuovo, Milano",https://www.immobiliare.it/annunci/122028122/
"Quadrilocale via Quadronno 34, Quadronno - Crocetta, Milano",https://www.immobiliare.it/annunci/122027108/
"Trilocale corso Plebisciti 19, Plebisciti - Susa, Milano",https://www.immobiliare.it/annunci/122039528/
"Bilocale corso Plebisciti 19, Plebisciti - Susa, Milano",https://www.immobiliare.it/annunci/122040296/
"Bilocale via Tito Livio 26, Lodi - Brenta, Milano",https://www.immobiliare.it/annunci/122033294/
"Trilocale via Francesco Reina 35, Argonne - Corsica, Milano",https://www.immobiliare.it/annunci/122069284/
"Trilocale piazzale Giulio Cesare, Amendola - Buonarroti, Milano",https://www.immobiliare.it/annunci/122035918/
"Appartamento via Giordano Bruno 18, Paolo Sarpi, Milano",https://www.immobiliare.it/annunci/122044736/
"Monolocale corso Plebisciti 19, Plebisciti - Susa, Milano",https://www.immobiliare.it/annunci/122041052/
"Quadrilocale via Quadronno 34, Quadronno - Crocetta, Milano",https://www.immobiliare.it/annunci/122035768/
"Appartamento via Accademia 61, Casoretto, Milano",https://www.immobiliare.it/annunci/122033142/
"Bilocale via Giuseppe Ripamonti 222, Vigentino - Fatima, Milano",https://www.immobiliare.it/annunci/122034004/
"Appartamento piazza Argentina, Buenos Aires, Milano",https://www.immobiliare.it/annunci/122037982/
"Appartamento viale Ortles 54, Corvetto, Milano",https://www.immobiliare.it/annunci/122026558/
"Quadrilocale via Cesare Pavese 10, Precotto, Milano",https://www.immobiliare.it/annunci/122040986/
"Bilocale via Antonio Canova, Arco della Pace, Milano",https://www.immobiliare.it/annunci/122031238/
"Bilocale viale Pisa 5, Gambara, Milano",https://www.immobiliare.it/annunci/122044826/
"Monolocale via Cenisio 68, Cenisio, Milano",https://www.immobiliare.it/annunci/122043666/
"Bilocale ottimo stato, terzo piano, Sempione, Milano",https://www.immobiliare.it/annunci/122031628/
"Trilocale via PAOLO FRISI, Porta Venezia, Milano",https://www.immobiliare.it/annunci/122035820/
"Quadrilocale via Tullo Morgagni 19, Maggiolina, Milano",https://www.immobiliare.it/annunci/122045950/
"Terratetto unifamiliare via Monte Altissimo, Certosa, Milano",https://www.immobiliare.it/annunci/122042062/
"Trilocale via Angelo della Pergola 4, Isola, Milano",https://www.immobiliare.it/annunci/122032228/
"Bilocale piazza Durante 36, Milano",https://www.immobiliare.it/annunci/122031532/
"Bilocale via Giuseppe Maria Giulietti, Crescenzago, Milano",https://www.immobiliare.it/annunci/122026726/
"Bilocale via Merano 6, Rovereto, Milano",https://www.immobiliare.it/annunci/122045042/
"Trilocale viale Nazario Sauro 7, Isola, Milano",https://www.immobiliare.it/annunci/122044336/
"Appartamento via Giuseppe Mazzini 20, Duomo, Milano",https://www.immobiliare.it/annunci/122042408/
"Bilocale piazza Cardinale Pietro Gasparri 4, Comasina, Milano",https://www.immobiliare.it/annunci/122035980/
"Bilocale via Ruggero Boscovich 30, Centrale, Milano",https://www.immobiliare.it/annunci/122027832/
"Bilocale via Paolo Mezzanotte, Vigentino - Fatima, Milano",https://www.immobiliare.it/annunci/122047002/
"Trilocale via Carlo Pisacane, Indipendenza, Milano",https://www.immobiliare.it/annunci/122020150/
"Trilocale via Chiari 5, Certosa, Milano",https://www.immobiliare.it/annunci/122034174/
"Bilocale via Paolo Santagostino 1, Niguarda, Milano",https://www.immobiliare.it/annunci/122042730/
"Bilocale via Appennini 81c, Gallaratese, Milano",https://www.immobiliare.it/annunci/122028624/
"Trilocale via Mortara 4, Navigli - Darsena, Milano",https://www.immobiliare.it/annunci/122040210/
"Trilocale ottimo stato, su più livelli, San Siro, Milano",https://www.immobiliare.it/annunci/122033182/
"Trilocale viale Lucania 21, Corvetto, Milano",https://www.immobiliare.it/annunci/122075998/
"Bilocale viale Marche 99, Farini, Milano",https://www.immobiliare.it/annunci/122029282/
"Trilocale via Rosalba Carriera 5, Giambellino, Milano",https://www.immobiliare.it/annunci/122019804/
"Trilocale viale Molise, Molise - Cuoco, Milano",https://www.immobiliare.it/annunci/122040776/
"Bilocale viale Monza 101, Rovereto, Milano",https://www.immobiliare.it/annunci/122036212/
"Bilocale via Emilio Faà di Bruno 14, Martini - Insubria, Milano",https://www.immobiliare.it/annunci/122045756/
"Trilocale via Giuseppe Tartini, Dergano, Milano",https://www.immobiliare.it/annunci/122031642/
"Trilocale via Poggibonsi 8, Gambara, Milano",https://www.immobiliare.it/annunci/122033168/
"Appartamento all'asta corso Como 6, Milano",https://www.immobiliare.it/annunci/122040922/
"Appartamento all'asta via Sebastiano del Piombo 12, Milano",https://www.immobiliare.it/annunci/122039644/
"Bilocale via Adele Zoagli 5, Vialba, Milano",https://www.immobiliare.it/annunci/122021400/
"Trilocale corso di Porta Vittoria, Guastalla, Milano",https://www.immobiliare.it/annunci/122045728/
"Attico viale Ortles 3, Ripamonti, Milano",https://www.immobiliare.it/annunci/122039080/
"Loft via Ebro 11, Ripamonti, Milano",https://www.immobiliare.it/annunci/122041524/
"Attico via Broni 31, Vigentino - Fatima, Milano",https://www.immobiliare.it/annunci/122036252/
"Trilocale via Cuore Immacolato di Maria 10/A, Vigentino - Fatima, Milano",https://www.immobiliare.it/annunci/122041136/
"Trilocale via Roberto Fulton 4, Bruzzano, Milano",https://www.immobiliare.it/annunci/122032498/
"Bilocale via Lodovico Muratori 54, Porta Romana - Medaglie d'Oro, Milano",https://www.immobiliare.it/annunci/122036122/
"Quadrilocale via Privata Linda Malnati, 5, San Siro, Milano",https://www.immobiliare.it/annunci/122021388/
"Trilocale via Lomellina, 31, Argonne - Corsica, Milano",https://www.immobiliare.it/annunci/122021384/
"Trilocale via Plinio 29, Buenos Aires, Milano",https://www.immobiliare.it/annunci/122027608/
"Loft via Filippo Palizzi 119, Quarto Oggiaro, Milano",https://www.immobiliare.it/annunci/122034830/
"Monolocale via Matteo Maria Boiardo 22, Turro, Milano",https://www.immobiliare.it/annunci/122044846/
"Trilocale viale Col di Lana 6A, Ticinese, Milano",https://www.immobiliare.it/annunci/122031856/
"Appartamento via Melchiorre Gioia 141, Maggiolina, Milano",https://www.immobiliare.it/annunci/122046452/
"Bilocale via delle Leghe 14, Pasteur, Milano",https://www.immobiliare.it/annunci/122027274/
"Bilocale via dei Gracchi 26, Frua, Milano",https://www.immobiliare.it/annunci/122031048/
"Appartamento via Emilio Morosini 12, Montenero, Milano",https://www.immobiliare.it/annunci/122044876/
"Trilocale via Bernardino Verro 78, Vigentino - Fatima, Milano",https://www.immobiliare.it/annunci/122039664/
"Monolocale via Sebino 17, Martini - Insubria, Milano",https://www.immobiliare.it/annunci/122025578/
"Trilocale via Francesco Rezzonico 4, Porta Vittoria, Milano",https://www.immobiliare.it/annunci/122025984/
"Bilocale via Giovanni Livraghi, Precotto, Milano",https://www.immobiliare.it/annunci/122040228/
"Bilocale via Giovanni Livraghi, Precotto, Milano",https://www.immobiliare.it/annunci/122040076/
"Bilocale piazza della Repubblica, Repubblica, Milano",https://www.immobiliare.it/annunci/122077478/
"Bilocale via Pomezia 10, Pasteur, Milano",https://www.immobiliare.it/annunci/122040384/
"Bilocale via Luigi Canonica 37, Arena, Milano",https://www.immobiliare.it/annunci/122043956/
"Bilocale via Teocrito 48, Gorla, Milano",https://www.immobiliare.it/annunci/122039808/
"Trilocale via Francesco Predabissi 3, Parco Trotter, Milano",https://www.immobiliare.it/annunci/122031928/
"Trilocale via Giovanni Livraghi, Precotto, Milano",https://www.immobiliare.it/annunci/122039518/
"Trilocale viale Belisario, City Life, Milano",https://www.immobiliare.it/annunci/122036208/
"Bilocale via Teocrito 48, Gorla, Milano",https://www.immobiliare.it/annunci/122043498/
"Monolocale via Pigello Portinari 2, Greco - Segnano, Milano",https://www.immobiliare.it/annunci/122037938/
"Bilocale via Carlo d'Adda 1A, Navigli - Darsena, Milano",https://www.immobiliare.it/annunci/122024828/
"Bilocale via Ponte di Legno 2, Quartiere Feltre, Milano",https://www.immobiliare.it/annunci/122044716/
