titolo_annuncio,link_annuncio
"Trilocale via Trebbia 25, Porta Romana - Medaglie d'Oro, Milano",https://www.immobiliare.it/annunci/122115790/
"Bilocale via Cesare da Sesto 10, Corso Genova, Milano",https://www.immobiliare.it/annunci/122108650/
"Bilocale via Giuseppe Ripamonti 218, Vigentino - Fatima, Milano",https://www.immobiliare.it/annunci/122120328/
"Appartamento via Amedeo d'Aosta 3, Città Studi, Milano",https://www.immobiliare.it/annunci/122121510/
"Monolocale via Felice Casati 1, Buenos Aires, Milano",https://www.immobiliare.it/annunci/122123108/
"Trilocale via Pontaccio 8, Brera, Milano",https://www.immobiliare.it/annunci/122113206/
"Quadrilocale via Gaudenzio Ferrari 3, Corso Genova, Milano",https://www.immobiliare.it/annunci/122117744/
"Trilocale via Gerolamo Arganini 30, Niguarda, Milano",https://www.immobiliare.it/annunci/122117036/
"Bilocale via Concilio Vaticano II 1, Quarto Oggiaro, Milano",https://www.immobiliare.it/annunci/122118062/
"Appartamento via Fetonte, San Siro, Milano",https://www.immobiliare.it/annunci/122114940/
"Quadrilocale viale Monte Santo, Porta Nuova, Milano",https://www.immobiliare.it/annunci/122119050/
"Bilocale via Anacreonte 7, Cimiano, Milano",https://www.immobiliare.it/annunci/122113510/
"Trilocale viale Lombardia 30, Città Studi, Milano",https://www.immobiliare.it/annunci/122118468/
"Quadrilocale via Lecco 6, Porta Venezia, Milano",https://www.immobiliare.it/annunci/122120936/
"Quadrilocale via Garofalo, Città Studi, Milano",https://www.immobiliare.it/annunci/122113620/
"Bilocale via Gardone 29, Corvetto, Milano",https://www.immobiliare.it/annunci/122117462/
"Bilocale via Vittoria Colonna 25, Amendola - Buonarroti, Milano",https://www.immobiliare.it/annunci/122120320/
"Trilocale ottimo stato, primo piano, Buenos Aires, Milano",https://www.immobiliare.it/annunci/122119124/
"Monolocale via Pietro Maroncelli 11, Garibaldi - Corso Como, Milano",https://www.immobiliare.it/annunci/122120476/
"Bilocale Ripa di Porta Ticinese 21, Navigli - Darsena, Milano",https://www.immobiliare.it/annunci/122118034/
"Quadrilocale via Bernardo Davanzati 5, Dergano, Milano",https://www.immobiliare.it/annunci/122113396/
"Bilocale via Lodovico Montegani 1, Cermenate - Abbiategrasso, Milano",https://www.immobiliare.it/annunci/122120852/
"Trilocale via Gaspare Aselli 18, Città Studi, Milano",https://www.immobiliare.it/annunci/122123016/
"Monolocale via Cesare da Sesto 10, Corso Genova, Milano",https://www.immobiliare.it/annunci/122108634/
"Bilocale via Pontaccio 2, Lanza, Milano",https://www.immobiliare.it/annunci/122113144/
"Trilocale via Cardinale Giovanni Cagliero, Maggiolina, Milano",https://www.immobiliare.it/annunci/122122614/
"Quadrilocale via Felicité Robert De Lamennais 15, Quarto Cagnino, Milano",https://www.immobiliare.it/annunci/122106682/
"Trilocale via Eugenio Vaina 1, Quadronno - Crocetta, Milano",https://www.immobiliare.it/annunci/122124498/
"Trilocale via Vespri Siciliani 1, Piazza Napoli, Milano",https://www.immobiliare.it/annunci/122115182/
"Trilocale via Soperga 40, Pasteur, Milano",https://www.immobiliare.it/annunci/122118016/
"Quadrilocale corso Giuseppe Garibaldi 104, Moscova, Milano",https://www.immobiliare.it/annunci/122116884/
"Trilocale via Giulio e Corrado Venini 61, Pasteur, Milano",https://www.immobiliare.it/annunci/122120242/
"Monolocale via Giovanni Paisiello 4, Città Studi, Milano",https://www.immobiliare.it/annunci/122116210/
"Bilocale via Francesco Predabissi 3, Parco Trotter, Milano",https://www.immobiliare.it/annunci/122120528/
"Bilocale via Val Strona 6, Martini - Insubria, Milano",https://www.immobiliare.it/annunci/122119318/
"Appartamento all'asta via Manfredonia, 6, Milano",https://www.immobiliare.it/annunci/122121500/
"Bilocale via Soperga 40, Pasteur, Milano",https://www.immobiliare.it/annunci/122118236/
"Monolocale via Marco D'Agrate 23, Corvetto, Milano",https://www.immobiliare.it/annunci/122116574/
"Bilocale via Giulio e Corrado Venini 61, Pasteur, Milano",https://www.immobiliare.it/annunci/122120382/
"Trilocale via Marco d'Agrate 23, Corvetto, Milano",https://www.immobiliare.it/annunci/122120550/
"Appartamento all'asta via Selvanesco, Milano",https://www.immobiliare.it/annunci/122109446/
"Bilocale via Ilarione Rancati 21, Turro, Milano",https://www.immobiliare.it/annunci/122113670/
"Appartamento all'asta via Francesco Burlamacchi, 11, Milano",https://www.immobiliare.it/annunci/122117230/
"Appartamento all'asta corso Sempione, 63, Milano",https://www.immobiliare.it/annunci/122116292/
"Bilocale via della Torre 32, Turro, Milano",https://www.immobiliare.it/annunci/122119238/
"Trilocale via degli Umiliati, 16, Ponte Lambro, Milano",https://www.immobiliare.it/annunci/122108534/
"Appartamento via Ippodromo 76, Gallaratese, Milano",https://www.immobiliare.it/annunci/122123152/
"Bilocale via Spagnoletto 19, Monte Rosa - Lotto, Milano",https://www.immobiliare.it/annunci/122116022/
"Quadrilocale via Zuara 8, Tripoli - Soderini, Milano",https://www.immobiliare.it/annunci/122116374/
"Appartamento all'asta via Angiolo Maffucci 59, Milano",https://www.immobiliare.it/annunci/122124162/
"Quadrilocale viale Carlo Troya 8A, Piazza Napoli, Milano",https://www.immobiliare.it/annunci/122116180/
"Trilocale piazzale Lorenzo Lotto 13, San Siro, Milano",https://www.immobiliare.it/annunci/122115802/
"Trilocale viale Carlo Troya 22, Piazza Napoli, Milano",https://www.immobiliare.it/annunci/122116048/
"Bilocale via Brivio 6, Bovisa, Milano",https://www.immobiliare.it/annunci/122117102/
"Trilocale via Padova 79, Parco Trotter, Milano",https://www.immobiliare.it/annunci/122120908/
"Appartamento all'asta via Manfredonia 6, Milano",https://www.immobiliare.it/annunci/122123074/
"Bilocale via Giovanni Pacini, Città Studi, Milano",https://www.immobiliare.it/annunci/122119148/
"Trilocale via Quinto Romano 76, Baggio, Milano",https://www.immobiliare.it/annunci/122114426/
"Bilocale via Giovanni Pacini, Città Studi, Milano",https://www.immobiliare.it/annunci/122119360/
"Loft via Giovanni Pascoli, Città Studi, Milano",https://www.immobiliare.it/annunci/122119994/
"Bilocale via Niccolò Paganini 9, Buenos Aires, Milano",https://www.immobiliare.it/annunci/122123414/
"Trilocale via Gaetano Donizetti, Palestro, Milano",https://www.immobiliare.it/annunci/122114504/
"Bilocale via Edmondo De Amicis, Corso Genova, Milano",https://www.immobiliare.it/annunci/122115562/
"Quadrilocale viale Vittorio Veneto, Porta Venezia, Milano",https://www.immobiliare.it/annunci/122115756/
"Appartamento via Giuseppe Frua, Frua, Milano",https://www.immobiliare.it/annunci/122115988/
"Trilocale Galleria Unione, Missori, Milano",https://www.immobiliare.it/annunci/122115928/
"Trilocale via Giovanni Pierluigi da Palestrina, Buenos Aires, Milano",https://www.immobiliare.it/annunci/122114332/
"Trilocale via Ippodromo, San Siro, Milano",https://www.immobiliare.it/annunci/122115966/
"Trilocale viale Carlo Espinasse 63, Certosa, Milano",https://www.immobiliare.it/annunci/122113876/
"Monolocale piazza San Materno 8, Casoretto, Milano",https://www.immobiliare.it/annunci/122114974/
"Appartamento all'asta via Manfredonia 6, Milano",https://www.immobiliare.it/annunci/122112924/
"Trilocale via Tranquillo Cremona 12, Pagano, Milano",https://www.immobiliare.it/annunci/122120898/
"Trilocale da ristrutturare, primo piano, Primaticcio, Milano",https://www.immobiliare.it/annunci/122118868/
"Loft via Cristoforo Gluck 50, Cascina dei Pomi, Milano",https://www.immobiliare.it/annunci/122122406/
"Bilocale ottimo stato, terzo piano, Paolo Sarpi, Milano",https://www.immobiliare.it/annunci/122113566/
"Bilocale via Mantova 7, Porta Romana - Medaglie d'Oro, Milano",https://www.immobiliare.it/annunci/122126586/
"Appartamento via Pietro Marocco 20, Pasteur, Milano",https://www.immobiliare.it/annunci/122125936/
"Trilocale via Carlo Tenca 5, Repubblica, Milano",https://www.immobiliare.it/annunci/122126842/
"Trilocale via Rovello 19, Duomo, Milano",https://www.immobiliare.it/annunci/122126554/
"Monolocale via Fratelli Bronzetti 20, Indipendenza, Milano",https://www.immobiliare.it/annunci/122120990/
"Bilocale via Giampietro Lucini 19, Maggiolina, Milano",https://www.immobiliare.it/annunci/122124718/
"Trilocale da ristrutturare, Porta Romana - Medaglie d'Oro, Milano",https://www.immobiliare.it/annunci/122124898/
"Bilocale via Padulli 12, Piazzale Siena, Milano",https://www.immobiliare.it/annunci/122126078/
"Bilocale via marcantonio colonna 46, Portello - Parco Vittoria, Milano",https://www.immobiliare.it/annunci/122126192/
"Trilocale via Giancarlo Sismondi 62, Argonne - Corsica, Milano",https://www.immobiliare.it/annunci/122126650/
"Bilocale via Giovanni Livraghi, Precotto, Milano",https://www.immobiliare.it/annunci/122127308/
"Trilocale viale Zara 63, Zara, Milano",https://www.immobiliare.it/annunci/122126596/
"Trilocale via kramer 21, Piave - Tricolore, Milano",https://www.immobiliare.it/annunci/122127410/
"Bilocale via BALZAC 11, Precotto, Milano",https://www.immobiliare.it/annunci/122126598/
"Trilocale via Maddalena Donadoni Giudice, Bovisa, Milano",https://www.immobiliare.it/annunci/122126354/
"Trilocale via Michele Pericle Negrotto 43, Bovisa, Milano",https://www.immobiliare.it/annunci/122124356/
"Bilocale via Garofalo 32, Città Studi, Milano",https://www.immobiliare.it/annunci/122126024/
"Trilocale via Zante 19, Quartiere Forlanini, Milano",https://www.immobiliare.it/annunci/122126498/
"Trilocale via Giuseppe Ripamonti 304, Vigentino - Fatima, Milano",https://www.immobiliare.it/annunci/122127408/
"Monolocale ottimo stato, secondo piano, Isola, Milano",https://www.immobiliare.it/annunci/122128678/
"Bilocale viale Omero 19, Corvetto, Milano",https://www.immobiliare.it/annunci/122128050/
"Bilocale via Labeone 7, Argonne - Corsica, Milano",https://www.immobiliare.it/annunci/122127872/
"Appartamento all'asta via Manfredonia 6, Milano",https://www.immobiliare.it/annunci/122122836/
"Bilocale via Labeone 7, Argonne - Corsica, Milano",https://www.immobiliare.it/annunci/122129268/
"Monolocale via Muzio Scevola 4, Lambrate, Milano",https://www.immobiliare.it/annunci/122127214/
"Trilocale ottimo stato, su più livelli, Piazza Napoli, Milano",https://www.immobiliare.it/annunci/122115808/
"Bilocale ottimo stato, primo piano, Casoretto, Milano",https://www.immobiliare.it/annunci/122117596/
"Bilocale via Viterbo 41, Bisceglie, Milano",https://www.immobiliare.it/annunci/122118332/
"Monolocale via Cristoforo Gluck 50, Cascina dei Pomi, Milano",https://www.immobiliare.it/annunci/122126326/
"Palazzo - stabile all'asta via Selvanesco 50, Milano",https://www.immobiliare.it/annunci/122124660/
"Appartamento all'asta viale San Gimignano, 2, Milano",https://www.immobiliare.it/annunci/122128980/
"Monolocale via Lazzaro Palazzi 8, Porta Venezia, Milano",https://www.immobiliare.it/annunci/122124324/
"Monolocale piazza Piero Gobetti 6, Città Studi, Milano",https://www.immobiliare.it/annunci/122120114/
"Monolocale via Santa Maria Valle 4, Carrobbio, Milano",https://www.immobiliare.it/annunci/122125722/
"Appartamento all'asta via Ercole Oldofredi 47, Milano",https://www.immobiliare.it/annunci/122129122/
"Bilocale via Adamello 10, Ripamonti, Milano",https://www.immobiliare.it/annunci/122124288/
"Bilocale via Giuseppe Dezza, Dezza, Milano",https://www.immobiliare.it/annunci/122116266/
"Attico via Mariotto Albertinelli 6, San Siro, Milano",https://www.immobiliare.it/annunci/122126448/
"Trilocale Alzaia Naviglio Pavese 12, Navigli - Darsena, Milano",https://www.immobiliare.it/annunci/122122566/
"Quadrilocale via delle Forze Armate 260, Baggio, Milano",https://www.immobiliare.it/annunci/122117106/
"Bilocale via Benaco 5, Lodi - Brenta, Milano",https://www.immobiliare.it/annunci/122108654/
"Trilocale buono stato, terzo piano, Centrale, Milano",https://www.immobiliare.it/annunci/122120454/
"Appartamento all'asta via Manfredonia, 6, Milano",https://www.immobiliare.it/annunci/122116054/
"Trilocale piazza Bruzzano 5, Bruzzano, Milano",https://www.immobiliare.it/annunci/122128358/
"Trilocale piazza Borromeo, Carrobbio, Milano",https://www.immobiliare.it/annunci/122115948/
"Trilocale via Andrea Palladio, Porta Romana - Medaglie d'Oro, Milano",https://www.immobiliare.it/annunci/122116514/
"Bilocale via Don Giovanni Minzoni 27, Bovisa, Milano",https://www.immobiliare.it/annunci/122128228/
"Bilocale ottimo stato, primo piano, Duomo, Milano",https://www.immobiliare.it/annunci/122128928/
"Monolocale via Rogoredo 103, Santa Giulia, Milano",https://www.immobiliare.it/annunci/122129254/
"Trilocale via Ernesto Breda 23, Bicocca, Milano",https://www.immobiliare.it/annunci/122122870/
"Villa bifamiliare via Brusuglio 49, Affori, Milano",https://www.immobiliare.it/annunci/122128484/
"Trilocale viale Regina Giovanna 24B, Porta Venezia, Milano",https://www.immobiliare.it/annunci/122117712/
"Trilocale via Giuseppe Sacconi 6, Corvetto, Milano",https://www.immobiliare.it/annunci/122118408/
"Trilocale via Trevi 5, Dergano, Milano",https://www.immobiliare.it/annunci/122128202/
"Bilocale via Padova 129, Cimiano, Milano",https://www.immobiliare.it/annunci/122120932/
"Trilocale ottimo stato, secondo piano, Ghisolfa - Mac Mahon, Milano",https://www.immobiliare.it/annunci/122123782/
"Bilocale via Caldera, Quarto Cagnino, Milano",https://www.immobiliare.it/annunci/122116980/
"Appartamento all'asta via Osteno, 2, Milano",https://www.immobiliare.it/annunci/122115548/
"Appartamento all'asta via Lucca, 8, Milano",https://www.immobiliare.it/annunci/122109818/
"Trilocale da ristrutturare, su più livelli, Casoretto, Milano",https://www.immobiliare.it/annunci/122124822/
"Trilocale viale Sarca 163, Bicocca, Milano",https://www.immobiliare.it/annunci/122116872/
"Appartamento all'asta via Manfredonia, 6, Milano",https://www.immobiliare.it/annunci/122124440/
"Appartamento all'asta via Felice Orsini, 70, Milano",https://www.immobiliare.it/annunci/122110104/
"Appartamento all'asta via Osteno, 2, Milano",https://www.immobiliare.it/annunci/122115536/
"Bilocale piazza Francesco Carrara 21, Cermenate - Abbiategrasso, Milano",https://www.immobiliare.it/annunci/122117220/
"Villa unifamiliare via Andrea Solari, Solari, Milano",https://www.immobiliare.it/annunci/122116240/
"Bilocale via Ippodromo 14, Gallaratese, Milano",https://www.immobiliare.it/annunci/122123654/
"Trilocale via Varesina 98, Certosa, Milano",https://www.immobiliare.it/annunci/122106146/
"Villa unifamiliare piazza Borromeo, Carrobbio, Milano",https://www.immobiliare.it/annunci/122116298/
"Trilocale via Francesco Primaticcio, Bande Nere, Milano",https://www.immobiliare.it/annunci/122118850/
"Bilocale via Fano 6, Bruzzano, Milano",https://www.immobiliare.it/annunci/122128286/
"Trilocale via Giuseppe La Farina 18, Bicocca, Milano",https://www.immobiliare.it/annunci/122121172/
"Bilocale via Ernesto Breda 162, Villa San Giovanni, Milano",https://www.immobiliare.it/annunci/122119082/
"Bilocale via Marcona 107, Plebisciti - Susa, Milano",https://www.immobiliare.it/annunci/122128832/
"Bilocale via Ponale 52, Bignami - Ponale, Milano",https://www.immobiliare.it/annunci/122127548/
"Bilocale via Ponale 52, Bignami - Ponale, Milano",https://www.immobiliare.it/annunci/122127704/
"Bilocale via Ponale 52, Bignami - Ponale, Milano",https://www.immobiliare.it/annunci/122127628/
"Appartamento all'asta via Manfredonia, 6, Milano",https://www.immobiliare.it/annunci/122116056/
"Bilocale via Marcello Prestinari 13, Bovisa, Milano",https://www.immobiliare.it/annunci/122120732/
"Attico largo Cairoli, Cadorna - Castello, Milano",https://www.immobiliare.it/annunci/122123094/
"Bilocale via Iglesias 35, Gorla, Milano",https://www.immobiliare.it/annunci/122116652/
"Bilocale via Fabio Mangone, Corso Genova, Milano",https://www.immobiliare.it/annunci/122124794/
"Monolocale corso Sempione 76, Sempione, Milano",https://www.immobiliare.it/annunci/122115904/
"Quadrilocale via Carlo Cicogna Mozzoni 25, Affori, Milano",https://www.immobiliare.it/annunci/122128508/
"Trilocale via Pasquale Miglioretti 2, Affori, Milano",https://www.immobiliare.it/annunci/122128174/
"Appartamento all'asta via Manfredonia, 6, Milano",https://www.immobiliare.it/annunci/122123212/
"Appartamento all'asta via Varesina, 62, Milano",https://www.immobiliare.it/annunci/122124384/
"Monolocale via Ponale 52, Bignami - Ponale, Milano",https://www.immobiliare.it/annunci/122127766/
"Appartamento all'asta via Felice Orsini, 70, Milano",https://www.immobiliare.it/annunci/122110106/
"Appartamento all'asta via Francesco Burlamacchi, 11, Milano",https://www.immobiliare.it/annunci/122113350/
"Appartamento all'asta via Selvanesco , 50, Milano",https://www.immobiliare.it/annunci/122113354/
"Appartamento all'asta via Lucca, 8, Milano",https://www.immobiliare.it/annunci/122109814/
"Trilocale ottimo stato, su più livelli, Bovisa, Milano",https://www.immobiliare.it/annunci/122117400/
"Trilocale corso di Porta Vigentina, Quadronno - Crocetta, Milano",https://www.immobiliare.it/annunci/122117688/
"Appartamento buono stato, primo piano, Corso Genova, Milano",https://www.immobiliare.it/annunci/122120120/
"Appartamento buono stato, piano rialzato, Gratosoglio, Milano",https://www.immobiliare.it/annunci/122115060/
"Appartamento all'asta via Angelo della Pergola, 11, Milano",https://www.immobiliare.it/annunci/122124622/
"Bilocale via Cenisio 46, Cenisio, Milano",https://www.immobiliare.it/annunci/122115804/
"Bilocale piazza Giovanni Perego 7, Cenisio, Milano",https://www.immobiliare.it/annunci/122108118/
"Monolocale via Carlo Farini 64, Farini, Milano",https://www.immobiliare.it/annunci/122108134/
"Bilocale piazza Davide Sesia 5, Turro, Milano",https://www.immobiliare.it/annunci/122108142/
"Palazzo - stabile all'asta via Manfredonia,, 20142 Milano Italia, Milano",https://www.immobiliare.it/annunci/122107662/
"Trilocale viale Monte Ceneri 58, Ghisolfa - Mac Mahon, Milano",https://www.immobiliare.it/annunci/122108132/
"Monolocale via Francesco Redi, 28, Morgagni, Milano",https://www.immobiliare.it/annunci/122124172/
"Trilocale buono stato, piano rialzato, Paolo Sarpi, Milano",https://www.immobiliare.it/annunci/122120254/
"Bilocale via Chiese 46, Bignami - Ponale, Milano",https://www.immobiliare.it/annunci/122108126/
"Trilocale corso di Porta Vigentina, Quadronno - Crocetta, Milano",https://www.immobiliare.it/annunci/122122652/
"Appartamento all'asta via M. Saponaro, 18, Milano",https://www.immobiliare.it/annunci/122120274/
"Appartamento all'asta via Ercole Oldofredi, 47, Milano",https://www.immobiliare.it/annunci/122120276/
"Appartamento all'asta via Privata Angiolo Maffucci, 59, Milano",https://www.immobiliare.it/annunci/122120264/
"Trilocale nuovo, primo piano, Piazzale Siena, Milano",https://www.immobiliare.it/annunci/122116766/
"Palazzo - Edificio via Carlo Imbonati 81, Dergano, Milano",https://www.immobiliare.it/annunci/122128206/
"Trilocale via Cesare da Sesto 10, Corso Genova, Milano",https://www.immobiliare.it/annunci/122108580/
"Trilocale via Giancarlo Sismondi 62, Argonne - Corsica, Milano",https://www.immobiliare.it/annunci/122126616/
"Trilocale via Pisanello , 2, Gambara, Milano",https://www.immobiliare.it/annunci/122088770/
"Bilocale via Sardegna, Frua, Milano",https://www.immobiliare.it/annunci/122089542/
"Bilocale via Elia Lombardini 12, Navigli - Darsena, Milano",https://www.immobiliare.it/annunci/122104424/
"Bilocale via Giovanni da Procida 6, Sempione, Milano",https://www.immobiliare.it/annunci/122095968/
Appartamenti e Attici di nuova costruzione a Milano,https://www.immobiliare.it/annunci/122093650/
"Trilocale via Doberdò 14, Villa San Giovanni, Milano",https://www.immobiliare.it/annunci/122098194/
"Bilocale piazza castelli 3, Certosa, Milano",https://www.immobiliare.it/annunci/122097840/
"Bilocale via Cesare da Sesto 10, Corso Genova, Milano",https://www.immobiliare.it/annunci/122088280/
"Trilocale via Cesare da Sesto 10, Corso Genova, Milano",https://www.immobiliare.it/annunci/122087984/
"Monolocale via Cesare da Sesto 10, Corso Genova, Milano",https://www.immobiliare.it/annunci/122087526/
"Trilocale via Lecco 6, Porta Venezia, Milano",https://www.immobiliare.it/annunci/122093228/
"Quadrilocale via Gianfranco Malipiero 12, Viale Ungheria - Mecenate, Milano",https://www.immobiliare.it/annunci/122089104/
"Trilocale via Tortona 37, Navigli - Darsena, Milano",https://www.immobiliare.it/annunci/122100950/
"Trilocale via Francesco Rismondo 110, Baggio, Milano",https://www.immobiliare.it/annunci/122093048/
"Bilocale via Luigi Sacco 9, Frua, Milano",https://www.immobiliare.it/annunci/122083624/
"Trilocale Alzaia Naviglio Grande 36, Navigli - Darsena, Milano",https://www.immobiliare.it/annunci/122090860/
"Loft viale Vincenzo Lancetti 48, Farini, Milano",https://www.immobiliare.it/annunci/122090834/
"Bilocale via Jacopo Dal Verme 1, Isola, Milano",https://www.immobiliare.it/annunci/122099506/
"Bilocale piazzale di Porta Lodovica, Ticinese, Milano",https://www.immobiliare.it/annunci/122094588/
"Trilocale via Luigi Settembrini 46, Buenos Aires, Milano",https://www.immobiliare.it/annunci/122098578/
"Quadrilocale via Avancinio Avancini 16, Chiesa Rossa, Milano",https://www.immobiliare.it/annunci/122087368/
"Bilocale piazza Pompeo Castelli 12, Bovisa, Milano",https://www.immobiliare.it/annunci/122088528/
"Monolocale via FRANCESCO REDI 28, Morgagni, Milano",https://www.immobiliare.it/annunci/122089092/
"Bilocale buono stato, secondo piano, Sant'Ambrogio, Milano",https://www.immobiliare.it/annunci/122095798/
"Monolocale via Monti Sabini 11, Vigentino - Fatima, Milano",https://www.immobiliare.it/annunci/122096462/
"Appartamento via Terraggio, Sant'Ambrogio, Milano",https://www.immobiliare.it/annunci/122090996/
"Monolocale via Gianfranco Malipiero 12, Viale Ungheria - Mecenate, Milano",https://www.immobiliare.it/annunci/122093686/
"Monolocale via Gianfranco Malipiero 12, Viale Ungheria - Mecenate, Milano",https://www.immobiliare.it/annunci/122090412/
"Bilocale via Principe Eugenio 15, Cenisio, Milano",https://www.immobiliare.it/annunci/122088806/
"Trilocale via Carlo Tenca 5, Repubblica, Milano",https://www.immobiliare.it/annunci/122099496/
"Trilocale via Alfonso Capecelatro 22, San Siro, Milano",https://www.immobiliare.it/annunci/122104010/
"Bilocale via Giuseppe Ripamonti 205, Vigentino - Fatima, Milano",https://www.immobiliare.it/annunci/122093428/
"Trilocale via Francesco Filelfo 6, Sempione, Milano",https://www.immobiliare.it/annunci/122097160/
"Trilocale via Serviliano Lattuada, Porta Romana - Medaglie d'Oro, Milano",https://www.immobiliare.it/annunci/122093376/
"Trilocale via Aristide De Togni 27, San Vittore, Milano",https://www.immobiliare.it/annunci/122102188/
"Trilocale via George Washington, Solari, Milano",https://www.immobiliare.it/annunci/122096098/
"Bilocale via Federico Faruffini 12, De Angeli, Milano",https://www.immobiliare.it/annunci/122094142/
"Quadrilocale via Lario 21, Zara, Milano",https://www.immobiliare.it/annunci/122101702/
"Bilocale via Giuseppe Saragat 13, Quartiere Adriano, Milano",https://www.immobiliare.it/annunci/122093690/
"Bilocale viale Caterina da Forlì, Bande Nere, Milano",https://www.immobiliare.it/annunci/122100512/
"Trilocale via Molinetto di Lorenteggio, Giambellino, Milano",https://www.immobiliare.it/annunci/122083208/
"Appartamento via degli Alerami, San Siro, Milano",https://www.immobiliare.it/annunci/122096554/
"Quadrilocale via Rimini 29, Famagosta, Milano",https://www.immobiliare.it/annunci/122083246/
"Monolocale via Paolo Mantegazza, 25, Bovisa, Milano",https://www.immobiliare.it/annunci/122083604/
"Trilocale via Cristoforo Gluck 2, Cascina dei Pomi, Milano",https://www.immobiliare.it/annunci/122103254/
"Monolocale corso Sempione 88, Sempione, Milano",https://www.immobiliare.it/annunci/122096210/
"Monolocale via Paolo Lomazzo 16, Paolo Sarpi, Milano",https://www.immobiliare.it/annunci/122096416/
"Trilocale via Lazzaro Palazzi 10, Porta Venezia, Milano",https://www.immobiliare.it/annunci/122093560/
"Trilocale via Gardone 19, Corvetto, Milano",https://www.immobiliare.it/annunci/122091034/
"Bilocale via Privata Chioggia, 7, 20125 Milano Italia, Turro, Milano",https://www.immobiliare.it/annunci/122100290/
"Bilocale via Andrea Mantegna 7, Sempione, Milano",https://www.immobiliare.it/annunci/122092718/
"Appartamento all'asta via Francesco Burlamacchi 11, Milano",https://www.immobiliare.it/annunci/122093900/
"Trilocale via jacopino da tradate 14, Certosa, Milano",https://www.immobiliare.it/annunci/122098660/
"Bilocale via Lorenteggio, 47, Giambellino, Milano",https://www.immobiliare.it/annunci/122091654/
"Trilocale buono stato, quarto piano, Cascina Merlata - Musocco, Milano",https://www.immobiliare.it/annunci/122092316/
"Trilocale piazza Antonio Gramsci 2, Paolo Sarpi, Milano",https://www.immobiliare.it/annunci/122100532/
"Bilocale largo Tel Aviv 7, Cimiano, Milano",https://www.immobiliare.it/annunci/122088744/
"Bilocale via Cardinale Ascanio Sforza 69, Pezzotti - Meda, Milano",https://www.immobiliare.it/annunci/122099536/
"Bilocale via mac mahon 2,, Cenisio, Milano",https://www.immobiliare.it/annunci/122081322/
"Bilocale via Panfilo Castaldi 39, Porta Venezia, Milano",https://www.immobiliare.it/annunci/122091084/
"Bilocale viale Monza 149, Turro, Milano",https://www.immobiliare.it/annunci/122089268/
"Quadrilocale via Giuseppe Ripamonti 27, Porta Romana - Medaglie d'Oro, Milano",https://www.immobiliare.it/annunci/122103594/
"Quadrilocale via Pisanello , 2, Gambara, Milano",https://www.immobiliare.it/annunci/122088778/
"Trilocale via marescalchi 19, Città Studi, Milano",https://www.immobiliare.it/annunci/122091332/
"Monolocale via Giuseppe Tartini 13/C, Dergano, Milano",https://www.immobiliare.it/annunci/122104682/
"Bilocale via Albino 2, Primaticcio, Milano",https://www.immobiliare.it/annunci/122098410/
"Bilocale via Bernardino Verro 47, Ripamonti, Milano",https://www.immobiliare.it/annunci/122083758/
