titolo_annuncio,link_annuncio
"Bilocale via Francesco Brioschi 90, Pezzotti - Meda, Milano",https://www.immobiliare.it/annunci/122033562/
"Trilocale via Bernardo Rucellai 20/5, Precotto, Milano",https://www.immobiliare.it/annunci/122042044/
"Bilocale piazza Antonio Gramsci 2, Paolo Sarpi, Milano",https://www.immobiliare.it/annunci/122028934/
"Loft via Aleardo Aleardi, 14, Paolo Sarpi, Milano",https://www.immobiliare.it/annunci/122022402/
"Trilocale viale Liguria 50, Famagosta, Milano",https://www.immobiliare.it/annunci/122040852/
"Appartamento all'asta via Ercole Oldofredi 47, Milano",https://www.immobiliare.it/annunci/122034870/
"Quadrilocale via Federico Engels 2, Quarto Cagnino, Milano",https://www.immobiliare.it/annunci/122046588/
"Appartamento all'asta via Stresa 1, Milano",https://www.immobiliare.it/annunci/122035574/
"Bilocale via Niccolò Copernico, Centrale, Milano",https://www.immobiliare.it/annunci/122027632/
"Bilocale via Guido Guinizelli 5, Pasteur, Milano",https://www.immobiliare.it/annunci/122032564/
"Bilocale piazza Po 7, Dezza, Milano",https://www.immobiliare.it/annunci/122028302/
"Trilocale via Milazzo 4, Moscova, Milano",https://www.immobiliare.it/annunci/122030394/
"Appartamento all'asta via Appennini 39, Milano",https://www.immobiliare.it/annunci/122022190/
"Monolocale via Ambrogio Binda 16, Barona, Milano",https://www.immobiliare.it/annunci/122028468/
"Appartamento all'asta via Cascina Corba 98, Milano",https://www.immobiliare.it/annunci/122034602/
"Appartamento all'asta via Negroli 23, Milano",https://www.immobiliare.it/annunci/122034594/
"Trilocale via Sapri 51, Cascina Merlata - Musocco, Milano",https://www.immobiliare.it/annunci/122039780/
"Bilocale via Mac Mahon 111, Certosa, Milano",https://www.immobiliare.it/annunci/122032690/
"Bilocale via Monte Oliveto 10, Ponte Lambro, Milano",https://www.immobiliare.it/annunci/122034506/
"Bilocale via Brembo 11, Lodi - Brenta, Milano",https://www.immobiliare.it/annunci/122031560/
"Appartamento all'asta via Varesina 62, Milano",https://www.immobiliare.it/annunci/122024924/
"Bilocale via Brembo 19, Lodi - Brenta, Milano",https://www.immobiliare.it/annunci/122043244/
"Bilocale via Mauro Macchi 50, Centrale, Milano",https://www.immobiliare.it/annunci/122070354/
"Bilocale piazza Giovanni Bausan, Bovisa, Milano",https://www.immobiliare.it/annunci/122040618/
"Bilocale viale Monte Ceneri 64, Ghisolfa - Mac Mahon, Milano",https://www.immobiliare.it/annunci/122040322/
"Trilocale via Tobruk 3, Tripoli - Soderini, Milano",https://www.immobiliare.it/annunci/122035448/
"Trilocale via Sibari 2, Vigentino - Fatima, Milano",https://www.immobiliare.it/annunci/122040338/
"Bilocale via Roberto Sarfatti, Bocconi, Milano",https://www.immobiliare.it/annunci/122033004/
"Bilocale via della Moscova 52, Moscova, Milano",https://www.immobiliare.it/annunci/122037206/
"Monolocale via Fratelli Lumière 4, Pasteur, Milano",https://www.immobiliare.it/annunci/122036038/
"Appartamento all'asta via Ercole Oldofredi 47, Milano",https://www.immobiliare.it/annunci/122042144/
"Bilocale largo Pomessi Sposi, 7, Cantalupa - San Paolo, Milano",https://www.immobiliare.it/annunci/122041920/
"Appartamento via Cernaia 11, Turati, Milano",https://www.immobiliare.it/annunci/122047430/
"Appartamento all'asta via Riccardo Balsamo Crivelli 18, Milano",https://www.immobiliare.it/annunci/122041548/
"Bilocale ottimo stato, piano terra, Lambrate, Milano",https://www.immobiliare.it/annunci/122034436/
"Trilocale via Panfilo Castaldi, 25, Porta Venezia, Milano",https://www.immobiliare.it/annunci/122030022/
"Quadrilocale via Piero della Francesca 52, Sempione, Milano",https://www.immobiliare.it/annunci/122041976/
"Trilocale viale Certosa, Cascina Merlata - Musocco, Milano",https://www.immobiliare.it/annunci/122045600/
"Monolocale via FARSAGLIA 1, Martini - Insubria, Milano",https://www.immobiliare.it/annunci/122032996/
"Trilocale ottimo stato, terzo piano, Plebisciti - Susa, Milano",https://www.immobiliare.it/annunci/122040062/
"Trilocale via dei missaglia, 13, Chiesa Rossa, Milano",https://www.immobiliare.it/annunci/122027930/
"Monolocale via Sebastiano Veniero, Monte Rosa - Lotto, Milano",https://www.immobiliare.it/annunci/122040148/
"Appartamento all'asta via Michele Saponaro 18, Milano",https://www.immobiliare.it/annunci/122028386/
"Appartamento all'asta via Appennini 39, Milano",https://www.immobiliare.it/annunci/122036202/
"Bilocale corso Lodi, Lodi - Brenta, Milano",https://www.immobiliare.it/annunci/122030658/
"Appartamento all'asta via M. Saponaro, Milano",https://www.immobiliare.it/annunci/122045124/
"Trilocale ottimo stato, quinto piano, Casoretto, Milano",https://www.immobiliare.it/annunci/122042440/
"Quadrilocale da ristrutturare, sesto piano, Città Studi, Milano",https://www.immobiliare.it/annunci/122056782/
"Monolocale largo Promessi Sposi 7, Cantalupa - San Paolo, Milano",https://www.immobiliare.it/annunci/122032050/
